736;   Подготовка к ЕГЭ по обществознанию (интенсивный курс) — Stepik; None; Данный курс  направлен на интенсивную подготовку к  ЕГЭ по обществознанию.  На протяжении восьми лекций мы разберем разные варианты ЕГЭ и сможем углубиться в сложные вопросы. ; Pelican Education; None 
738;   Информационное моделирование зданий — Stepik; 5; Курс посвящён изучению технологии информационного моделирования зданий на примере программы Autodesk Revit Architecture.; None; Albert Sumin, Sergey Shvydko, Maxim Stepannikov, George Glebov, Рустам Илажиев 
742;   Биохимия клетки — Stepik; None; Краткое описание основных биохимических путей в клетке; None; Vanda Lerer 
743;   Test — Stepik; None; test; None; Petr Bogdanov 
744;   course ffmmpp — Stepik; None; test; None; None 
746;   Тест — Stepik; None; Тест; None; Sergey E. Boitsov 
747;   test — Stepik; None; test; None; Mikhail Kostenko 
751;   Genetic Engineering — Stepik; None; Course; None; Rúben Fernandes 
753;   My Test Course — Stepik; None; Test Course; None; None 
754;   Математика — Stepik; None; На этом курсе вы будете решать математические задачи; None; Anonymous 2656880 
755;   Ф  — Stepik; None; Н; None; Алёна Чубюк 
759;   зоология — Stepik; None; Животный мир начиная от простейших и заканчивая высшими позвоночными животными. ; None; Елена Мугер 
760;   Курс — Stepik; None; небольшой курс для начинающих; None; Rodion Istomin 
763;   История восточных славян — Stepik; None; в данном курсе вы познакомитесь с занятиями, бытом, верованиями восточных славян.; None; Alexander Kokorev 
764;   GJH — Stepik; None; khjhj; None; Юля Поздеева 
765;   курс 1 — Stepik; None; с++; None; Вячеслав Никаноров 
766;   df — Stepik; None; ff; None; Юля Поздеева 
767;   test — Stepik; None; test; None; Юля Поздеева 
768;   виа — Stepik; None; ива; None; Юля Поздеева 
769;   C++ — Stepik; None; Курс изучения языка программирования C++; None; Anonymous 2656921 
775;   Ruby для начинающих — Stepik; None; Курс для тех, кто интересуется основами языка Ruby; None; Julian Kulesh 
778;   23 — Stepik; None; 23; None; Alexey Likhobabin 
779;   23 — Stepik; None; 23; None; Alexey Likhobabin 
798;   Pythontest — Stepik; None; Test af stepic.; None; Ronni Jensen 
801;   тестовый курс — Stepik; None; шитье; None; Наталья Стратилат 
802;   витамины — Stepik; None; история открытия, классификация, значения, авитаминозы; None; Елена Егорова 
803;   Творчество М Булгакова — Stepik; 1; Вы познакомитесь с биографией писателя и его творчеством; None; Елена Демина 
804;   Кулинария — Stepik; None; На данном курсе Вы научитесь правильно готовить, узнаете как хранить продукты , чтобы они не принесли вред здоровью и узнаете правила безопасности и гигиены при приготовлении пищи.; None; Ольга Алексюк 
805;   English for printers — Stepik; None; Английский язык для печатников; None; Владлена Щеглова 
806;   статистика — Stepik; None; основы и 1ые шаги в анализе данных; None; Valery Askerka 
807;   аааа — Stepik; None; бббб; None; Регина Дробова 
809;   Параллелограммы — Stepik; None; Знакомство с признаками и свойствами параллелограммов; None; Регина Дробова 
811;   Здравствуй мир! — Stepik; None; Знакомство с окружающим миром.; None; Людмила Выставкина 
812;   Курс о шитье — Stepik; None; В этом курсе Вы познакомитесь с материалами и инструментами для шитья.; None; Светлана Шестакова 
813;   Курс вышивки крестиком  — Stepik; None; На этом курсе вас обучат вышивать крестиком. ; None; Севинч Шихвердиева 
814;   Кулинария — Stepik; None; Вы узнаете как правильно питаться, чтобы быть бодрым, работоспособным и сохранять стройную фигуру, как определять качество продуктов, готовить новые блюда.; None; Ольга Алексюк 
816;   Сложноподчинённое предложение. — Stepik; None; В этом курсе вы получите основные знания о роли сложноподчинённых предложений в языке, их отличии от других видов сложного предложения, научитесь определять виды сложноподчинённых предложении и грамотно расставлять знаки препинания в предложениях данного вида.; None; Ольга Сычева 
817;   Как помочь зимой птицам? — Stepik; None; Курс для учащихся 1 классов; None; Svetlana Kazankova 
818;   Учение с увлечением — Stepik; None; Познакомить детей с основами учения с увлечением, подвести к мысли, что недостаточно просто учиться, необходимо учиться с увлечением; None; Александра Ахмедова 
819;   Простое настоящее время английских глаголов — Stepik; 2; После прохождения курса вы научитесь использовать изученную форму глагола в утвердительных и отрицательных фразах, задавать общие и специальные вопросы.; None; марина кравчук 
820;   ГИА 9 — Stepik; None; Типовые тестовые задания ГИА 9 ; None; Ольга Волошенко 
821;   Курс: Что такое химия? — Stepik; 4; В этом курсе вы получите основные знания о химии.; None; Катя Дрожбина 
822;   Курс  бисероплетения. Плетение и вышивка бисером. — Stepik; 5; Курс «Бисероплетение» позволит вам развить творческие навыки и научиться создавать настоящие произведения искусства. Обучение будет интересно для начинающих и тех, кто хотел бы систематизировать уже имеющиеся знания, освоить новые техники плетения бисером или приобрести дополнительные навыки.Цель программы:Формирование художественной культуры школьников как части культуры духовной, приобщение детей общечеловеческим и национальным ценностям через их собственное творчество и освоение художественного опыта прошлого.Задачи программы:Развитие творческих возможностей учащихся.    Изготовление поделок из бисера.    Воспитание трудолюбия, самостоятельности, эстетического вкуса, чувства прекрасного, гордости за свой выполненный труд.    Правильное использование цветовой гаммы.; None; Наталья Николаевна 
823;   Графы. — Stepik; None; Теория решения задач с помощью графов. ; None; Галина Удалова 
824;   Подготовка к ЕГЭ по английскому языку — Stepik; None; В данном курсе будет рассмотрена структура экзамена,  задания по разделам экзамена, вспомогательные материалы для подготовки к итоговой аттестации.; None; Анна Иванова 
825;   Нравственное основы воспитания ребенка в семье — Stepik; 2; Организация работы по нравственному воспитанию с семьей.; None; Игорь Миронов 
826;   Тестовый курс. Курс о шитье - 1. — Stepik; None; В этом курсе Вы познакомитесь с искусством шитья.; None; Светлана Шестакова 
827;   Компьютерная грамотность — Stepik; 1.7; предназначен для знакомства с цифровым миром и обучения основным понятиям и навыкам работы с компьютером. ; None; Анна Высоцкая 
828;   Present Simple — Stepik; None; Present Simple: affirmative, negative, interrogative sentences.; None; Юлия Сальникова 
829;   Курс: Что такое природоведение? — Stepik; None; В этом курсе вы получите основные знания о природоведении.; None; Юля Миронова 
831;   «Страна оригами» — Stepik; None; Кружок «Страна оригами» разработан  для того, чтобы через различные действия с бумагой, в процессе её обработки, через применение разных способов и приемов работы с ней, учить детей эстетически осмысливать образы знакомых предметов, передавать их в изобразительной деятельности, подчеркивая красоту и колоритность внешнего облика в преобразованной форме.        ; None; Гузель Рашидовна 
832;   История России с древности до начала  XVII века — Stepik; None; Курс посвящен истории нашей страны в период  с IX до нач. XVII века.; None; Светлана Кохановская 
833;   Тестовый курс по истории Древней Руси — Stepik; None; В этом курсе представлены тестовые задания по теме Древняя Русь  в IX-XII вв.; None; Светлана Кохановская 
834;   О Британии вкратце. — Stepik; 3.5; Данный курс поможет ученикам 8-9-ых классов лучше познакомиться со страной изучаемого языка, отработать навыки самостоятельной подготовки к различным заданиям, творческому подходу к его выполнению. Курс приобщит учащихся к использованию дополнительных источников информации, поможет формировать интерес к изучению страны, а также научит работать над записями различного рода информации путем составления конспектов.; None; Ирина Александрова 
835;   Чтение — Stepik; None; 2 класс; None; Юля Миронова 
836;   Информатика — Stepik; None; Курс включает в себя  начала теоретических основ информатики ; None; Елена Тарасова 
837;   Краткий курс психологии  в вопросах и ответах — Stepik; None; Учебное пособие для неспециальных факультетовпедагогических вузов; None; Анастасия Иванникова 
838;   История России. IX-XIII вв. — Stepik; None; В данном курсе по истории Древней Руси  представлены материалы, вопросы и задания,  по темам отражающим социально- экономическое, политическое и культурное развитие Руси в IX-XIII веках.; None; Lesya Urosaeva 
840;   Курс о шитье — Stepik; None; В этом курсе вы получите основные знания о шитье; None; Виктория Пономарева 
842;   7 класс Информация и информационные процессы — Stepik; None; курс поможет освоить систему знаний по данной теме; None; Ольга Зуева 
843;   Курс о технике безопасности на уроках физической культуры — Stepik; None; В этом курсе Вы получите краткую информацию о технике безопасности на уроках физической культуры. ; None; Екатерина Мышенкова 
844;   Математика. Обыкновенные дроби — Stepik; None; Данный курс разработан для учащихся 5 класса по теме "Обыкновенные дроби"; None; Ирина Леонидова 
845;   Английский с нуля — Stepik; 2.5; Сжатый курс  для тех, кто только начинает изучать английский язык; None; Севинч Шихвердиева 
846;   Курс: Литература — Stepik; None; Тестирование по произведению Салтыкова-Щедрина "Сказ о том, как один мужик двух генералов прокормил".; None; Tatyana Smirnova 
847;   Курс: Литература — Stepik; None; Тестирование по произведению Салтыкова-Щедрина "Сказ о том, как один мужик двух генералов прокормил".; None; Tatyana Smirnova 
848;   Африка — Stepik; None; Изучение географического положения; None; Татьяна Румянцева 
849;   Курс: Имя существительное. — Stepik; None; В этом курсе раскрыть понятия имена существительного.; None; Жанна Ковальчук 
850;   English for travelling — Stepik; None; Английский для  путешественников; None; Дарья Борзова 
851;   Формулы сокращенного умножения — Stepik; None; Курс предназначен для повторения и систематизации знаний по теме "Формулы сокращенного умножения".; None; Мария Леньшина 
853;   Части речи в английском языке — Stepik; 4; В этом курсе вы получите основные знания о частях речи в английском языке.; None; Анастасия Атавина 
855;   Информатика: Системы счисления. — Stepik; None; В этом курсе вы получите основные знания по теме "Системы счисления"; None; Алексей Ермихин 
856;   Глагол — Stepik; None; В этом курсе раскрыть понятие глагола.; None; Любовь Суева 
858;   МХК — Stepik; None; Изучение русского искусства; None; Ирина Монтвила 
859;   88 — Stepik; None; 0000; None; Alexey Likhobabin 
861;   Программирования на Javascript с нуля — Stepik; None; Данный цикл уроков позволит вам изучить синтаксис Javascript, ознакомится с базовыми понятиями программирования и ознакомится с принципом работы движка Javascript; None; Thats Linux 
862;   История России XVII века. — Stepik; None; В данном курсе будут рассмотрены темы, связанные с эпохой Смуты, а также правлением первых Романовых.; None; Ольга Тузова 
865;   Хозяйство России — Stepik; None; Курс по географии предназначен для учащихся 8-9 классов общеобразовательных школ. ; None; Ирина Михайловна 
867;   Звуки и буквы русского алфавита — Stepik; None; В этом курсе вы получите основные знания о буквах и звуках русского алфавита.; None; Вера Шумилина 
868;   Курс по Инженерной графике — Stepik; 3.8; В  этом курсе Вы получите основные знания о Инженерной графике; None; Марина Немкевич 
872;   Газовые законы — Stepik; None; Этот курс позволяет студентам самостоятельно изучить газовые законы, которые не входят в программу по физике для специальности Компьютерные системы и комплексы.; None; Людмила Михайлюкова 
873;   английский язык 2 класс — Stepik; None; задания для повторения материала на каникулах; None; Елена Мананникова 
874;   «Музыка вокруг нас» — Stepik; None; Знакомство детей с  музыкой ; None; Василя Якубова 
875;   кулинария — Stepik; None; учимся варить манную кашу; None; Ирина Петрова 
876;   валяние из шерсти  — Stepik; None; обучение сухому валянию из шерсти ; None; Умида Якубова 
877;   кулинария — Stepik; None; научить варить кашу; None; Ирина Петрова 
880;   Курс для обучения английскому языку по методике "Letterland". — Stepik; None; Обучающий курс для преподавателей английского языка, осуществляющих образовательную деятельность в дошкольных образовательных учреждениях. ; None; Екатерина Жерехова 
881;   Русский язык — Stepik; None; Обзорный курс русского языка. Некоторые сложные вопросы фонетики, орфоэпии, морфемики и словообразования.; None; Елена Волгина 
883;   Литературные места России — Stepik; None; В этом курсе вы получите основные знания о литературных местах России, связанных с именами писателей и поэтов, чьё творчество изучается на уроках литературы в 6 классе; None; Елена Рубцова 
885;   витамины — Stepik; None; тестовый курс; None; Елена Егорова 
886;   Национальные французские праздники  — Stepik; None; В этом курсе Вы получите основные знания о национальных французских праздниках; None; Анна Ивашина 
887;   Курс основы использования металлоискателя — Stepik; None; Работа с металлоискателем в полевых условиях; None; partinetadmin partinetadmin 
890;   Восточные славяне в древности — Stepik; None; В этом курсе вы познакомитесь с историей происхождения восточных славян, с их основными занятиями, бытом и нравами, верованиями; None; Оксана Коблюк 
892;   Математика с увлечением — Stepik; None; Математика - очень сложный, но вместе с тем и очень интересный предмет.Математика нужна и важна; None; Светлана Карпутцева 
895;   ффффф — Stepik; None; фффф; None; Mikhail Mehanig 
896;   "Волшебная нить " — Stepik; None; На протяжении всей истории человечества народное искусство было неотъемлемой частью национальной культуры. Народное искусство сохраняет традиции преемственности поколений, влияет на формирование художественных вкусов. Основу декоративно-прикладного искусства составляет творческий ручной труд мастера. Бисероплетение известно с глубокой древности как вид художественных ремесел. Из поколения в поколение передавались его лучшие традиции. Бисероплетение сохраняет свое значение и в наши дни. ; None; Елена Павловна 
897;   Продажи B2B — Stepik; None; Курс предназначен для KAM работающих в сфере продаж B2B; None; Oleg Yablonsky 
901;   Курс о шитье — Stepik; None; О шитье: в этом курсе Вы получите основные знания о шитье; None; Anonymous 18361880 
902;   Введение в дискретную математику — Stepik; 3.9; Курс позволит вам овладеть базовыми понятиями и принципами дискретной математики и некоторых ее смежных глав. Пройдя курс, вы сможете решать огромное количество задач, которые возникают как в жизни, так и в работе даже у нетехнических специалистов. Также курс можно рассматривать как предварительный для более продвинутых курсов по математике и анализу данных.; Bioinformatics Institute; Дмитрий Мелешко 
903;   fg — Stepik; None; fg; None; sdsds ssdfdfdf 
904;   Геометрия 7 класс — Stepik; None; Систематизация и обобщение полученных знаний за курс геометрии 7 класса, решение задач по всем темам, применение изученных свойств в комплексе при решении задач.; None; Anonymous 18374413 
906;   Курс о вышивание крестиком — Stepik; None; В этом курсе вы получите основные знание вышивания крестиком; None; Нунэ Оганесян 
907;   Программирование Pascal — Stepik; None; данный курс создан для изучения основ программирования в 10 классе.; None; Vova Yatis 
908;   Курс ошите — Stepik; None; шьем да шьем; None; Татьяна Овчинникова 
909;   Грамматика английского языка. — Stepik; None; Курс для учащихся 4 класса.Повторение времен английского языка (Настоящее продолженное, Настоящее простое, Прошедшее, Будущее время).; None; Татьяна Овчинникова 
