910;   Вежливые просьбы в английском языке — Stepik; None; Курс для изучающих английский, желающих получать позитив от общения с иностранцами. Возраст не имеет значения.; None; Виктория Королева 
911;   Живая природа — Stepik; None; Знакомство с миром животных.; None; Илона Шишкова 
913;   Пробный — Stepik; None; Описание; None; Vik Vik 
914;   Python 101 — Stepik; None; Basic python course; None; Eduardo None 
915;   Будущим первоклассникам — Stepik; None; Курс предназначен для детей 6-7 лет и их родителей.; None; Юлия Анисимова 
916;   Тематический тренажер по английскому языку (Письмо) — Stepik; None; В данном курсе будет рассмотрена структура экзамена, задания по разделам экзамена, вспомогательные материалы для подготовки к итоговой аттестации.; None; Ольга Смотрова 
917;   Первый раз в первый класс — Stepik; None; Курс готовить будущих первоклассников к школе; None; Юлия Анисимова 
920;   Обществознание. Подготовка к олимпиадам. Начальный курс — Stepik; None; Данный курс предназначен для подготовки к олимпиадам по обществознанию для учащихся 8 - 11 классов; None; Александр Пугач 
921;   Java Summer 16 — Stepik; None; This is the Java Course at Olympiad School for Summer 16 Session; None; Jeganathan Nanthivarman 
922;   Учимся писать сочинение — Stepik; None; Курс поможет учащимся писать любое сочинение; None; Екатерина Мызникова 
923;   "Волшебный бисер" — Stepik; None; Занятия декоративно-прикладным искусством открывают у   многих воспитанников новые пути познания народного творчества, обогащая ихвнутренний мир, позволяют с пользой провести свободное время.Изучая декоративно-прикладное искусство в кружке, воспитанники соединяют знания технических приемов с художественной фантазией, присущей их воображению, создают не только полезные, но и красивые изделия.    Вышивка - один из самых древних и распространенных видов декоративно- прикладного искусства. ; None; Наталья Николаевна 
924;   Nhập môn lập trình — Stepik; None; Sử dụng cho môn nhập môn lập trình tại khoa Khoa Học và Kỹ Thuật máy tính, ĐHBK HCM; None; Hung Vo 
925;   Создание корпоративной системы автматизации документооборота — Stepik; None; Создание СЭД; None; Vladimir Andreev 
926;   Одномерные массивы в С — Stepik; None; Массивы; None; Артем Арефьев 
927;   ку — Stepik; None; уц; None; Артем Арефьев 
928;   test — Stepik; None; test; None; Kirill Bulatov 
929;   English — Stepik; None; Английский язык; None; Мария Рылова 
932;   Math — Stepik; None; math; None; Ksenia Kargina 
971;   Pokemon! Gotta Catch 'Em All — Stepik; 5; Get to know all the Pokemons in adaptive learning way.https://stepic.org/course/971/adaptive; Nikolay Vyahhi; None 
1021;   Школьная физика. Механическая энергия — Stepik; None; Курс содержит подробный разбор одного из разделов механики: механической энергии. Будет полезен учащимся 10-11 классов при изучении в школе и при подготовке к ЕГЭ; None; Alexander Skomorokhov 
1048;   CS01-1617 — Stepik; None; Intro to Java programming language.; None; Mr. Koric 
1083;   test sumbission — Stepik; None; test; None; Alexey 👨🏼‍🌾 Pogibelev 
1123;   Introduction to Visual Programming — Stepik; None; This course is an introductory programming course for students. Event-driven and visual programming concepts will be presented. Course emphasis will be on the total program development process -- problem analysis, design, coding, testing, debugging and maintenance. Programming projects will involve common business problems that require data entry, display of calculated results, conditional testing, arithmetic operations, control breaks, array processing and data validation. Programs will be implemented using Visual Basic Express Edition 2015; None; nalines shanmugam 
1127;   Основы дискретной математики — Stepik; 5; В курсе излагаются базовые понятия современной дискретной математики - комбинаторики, теории графов и дискретной вероятности.; Computer Science Center (CS центр); Александр Омельченко 
1142;   Введение в NGS. Часть 1 — Stepik; 4.4; В первой части курса «Введение в технологии высокоэффективного секвенирования» вы познакомитесь с основными типами секвенирования, их применениями, контролем качества и многими другими аспектами применения этих технологий. Также вы научитесь самостоятельно проводить первичную обработку экспериментов, идентифицировать основные проблемы, возникающие в NGS-экспериментах, узнаете об основных используемых форматах данных и научитесь конвертировать и визуализировать их.; Bioinformatics Institute; Alexander Predeus 
1150;   Культурология — Stepik; 4.3; «Культурология» относится к дисциплинам базовой части гуманитарного, социального и экономического цикла, читаемым на всех направлениях подготовки СЗИУ РАНХиГС. Данный курс является обзорным, вводным для изучения «Культурологии» и используется в «смешанном» формате в основном образовательном процессе вуза.; None; СЗИУ РАНХиГС 
1172;   Bioinformatics UIC — Stepik; None; Module BioinformaticsUniversitat Internacional de Catalunya; None; Sònia Casillas 
1232;   Игрофикация — Stepik; 5; Этот курс - лучший онлайн-курс в России 2016 и 2017 гг. по мнению экспертного жюри EdCrunch - крупнейшей в Европе конференции по образованию. Сейчас у нас идёт кампания по написанию книги по игрофикации, актуализации и улучшению курса: https://boomstarter.ru/projects/Nefedev/igrofikatsiya_prevrati_rutinu_v_igru_poshagovoe_rukovodstvoПрисоединяйтесь! Там вас ждёт увлекательная игра и ценные награды. В том числе, приняв участие в кампании, вы можете получить доступ к курсу прямо сейчас!; None; Miroslava Bronnikova, Иван Нефедьев 
1233;   Введение в обработку естественного языка — Stepik; 4.4; Курс знакомит слушателей с основными концепциями, методами, инструментами и приложениями дисциплины "Обработка естественного языка" (Natural Language Processing); None; Павел Браславский 
1280;   Обработка изображений — Stepik; 4.6; Курс по обработке изображений на языке Python; Высшая школа экономики (НИУ ВШЭ); Влад Шахуро 
1378;   Классическая механика — Stepik; 5; Уникальный в своём роде онлайн-курс, позволяющий за сравнительно небольшой период времени подробно изучить школьный курс механики на профильном уровне. Учащиеся, успешно окончившие обучение, приобретут навыки решения сложных и нестандартных задач и смогут принять участие в олимпиадах по физике высокого статуса.; None; Andrew Suslov 
1383;   Подготовка к ОГЭ по Обществознанию — Stepik; None; Подготовка к ОГЭ по Обществознанию; None; BrainStory Me 
1452;   Курс для преподавателей Stepik — Stepik; 4.5; Курс о том, как создавать онлайн-курсы на Stepik своими руками.; None; Anna Glotova 
1471;   Алгебра логики — Stepik; None; Данный курс является выдержкой из школьного курса информатики (8 класс).; None; Кристина Борисовна 
1564;   Латинский язык: Грамматический конструктор — Stepik; 4.9; Латинский язык — это программирование от Античности: база для новейшей терминологии, корпус основополагающих юридических текстов, источник современной европейской литературы и культуры.; None; Aleksej Czernoreczeński 
1587;   Тренируй английский со Stepik — Stepik; 4.3; Курс содержит аудиозаписи из различных игр, новостей, обзоров. Предлагается прослушать аудиозапись и записать услышанное.; None; Anastasia Lavrenko, Maxim Skryabin 
1595;   Java. Functional programming — Stepik; 5; The course introduces elements of functional programming in Java 8. After completing this course, you should have a basic understanding of lambda expressions, functional interfaces, stream API, lazy evaluation, currying and monads.; None; Artyom Burylov 
1621;   Тренажер ЕГЭ 2017 / Математика. Профильный уровень. Первая часть — Stepik; None; Курс представляет собой набор задач из ЕГЭ по математике (профильный уровень, первая часть), созданный на основе открытого банка заданий ЕГЭ «Федерального института педагогических измерений».  В курсе нет разборов задач, есть только их автоматическая проверка. Предлагаются задачи по следующим темам: алгебра, уравнения и неравенства, функции, начала математического анализа, геометрия,  элементы комбинаторики, статистики и теории вероятностей.Все материалы абсолютно бесплатны.; None; Vasilyi Kuzminuh 
1655;   Китайский язык 汉语 — Stepik; 4.9; Восток дело тонкое. Каждый, кто бывал в Азии знает, что это вселенная с иными формами мышления, этикетом и нормами поведения. Именно поэтому данный курс не только  научит вас элементарным фразам, необходимым для прибывания в Китае, но и расскажет о  лайфхаках жизни в поднебесной и менталитете китайского народа.; None; Дарья Шурупова, Синьлэ Ван 
1671;   Intro to Web Programming — Stepik; None; Applied computer science; None; Justin Roth 
1677;   Техническая эксплуатация летательных аппаратов и двигателей — Stepik; 3.8; В этом курсе вы узнаете о необходимости использования гражданской авиации в экономике России, роли инженеров по техническому обслуживанию и ремонту авиационной техники, особенностях обучения в Самарском национальном исследовательском университете имени академика С.П. Королева.; None; Самарский университет, Владимир Сошин 
1780;   Операционные системы — Stepik; 4.9; Курс об основах внутреннего устройства ядра ОС. Несмотря на краткость, информации, данной в курсе, достаточно для написания простейшей многозадачной ОС. Для того чтобы работать с примерами, вам понадобятся средства разработки GNU (компилятор языка С и компоновщик) и утилита make.; Computer Science Center (CS центр); Михаил Кринкин 
1799;   Введение в метод молекулярной динамики — Stepik; None; В данном курсе вы познакомитесь с основами метода молекулярной динамики, изучите основные идеи и приемы, испольуемые при создании программы для моделирования методом молекулярной динамики, в том числе приемы экономии машинного времени, и даже сможите написать свою собственную программу для изучения Леннард-Джонсовской жидкости.; None; Андрей Савин 
1805;   Лексика.  — Stepik; None; Общеупотребительные, диалектные и профессиональные слова.Синонимы, антонимы, многозначные слова.; None; Светлана Викторовна Копылова 
1814;   Курс химии 9 класса — Stepik; None; Курс предназначен для изучения учащимися 9 классов общеобразовательных школ, находящимися на индивидуальном или домашнем обучении; Вероника Михайловна Воробьева; Лариса Николаевна Дорохова 
1818;   Устойчивое развитие — стратегия планеты Земля — Stepik; 4.8; Устойчивое развитие — это концепция, повсеместная реализация которой поможет человечеству удовлетворять собственные текущие потребности без ущерба для следующих поколений. Основная цель курса — предоставить широкой аудитории информацию об устойчивом развитии.Он предназначен для всех, кому интересна эта тема, не ограничен ни возрастными, ни образовательными, ни профессиональными рамками.; Открытая школа устойчивого развития; Неля Рахимова 
1838;   ПДД — Stepik; 4.8; Официальная база вопросов 2017.Потренируйся на знания правил дорожного движения.; Команда Stepik; Nikolay Vyahhi 
1841;   Теорема Менелая — Stepik; None; В курсе приведены доказательства теоремы Менелая, теоремы Дезарга и теоремы Чевы, подробно разобраны задачи на использование перечисленных теорем, предлагаются задачи для самостоятельного решения. Интересными являются исторические сведения по теме.; None; Виктория Авсюкова 
1861;   Векторная графика — Stepik; None; Курс предназначен для учеников 8-11 классов. Желающих углубить свои знания в области векторной графики, а также обучиться основам работы с программой Corel Draw. После каждой главы помещён тест, выполнение которого позволяет ученикам самостоятельно проверить и оценить приобретенные знания, обнаружить имеющиеся пробелы и сделать выводы.; None; София Комракова 
1866;   Теорема Пифагора: просто, сложно, интересно! — Stepik; None; В рамках этого курса слушатели изучат основы аналитической геометрии на плоскости, а также научатся решать широкий класс задач, в которых используется теорема Пифагора. ; Вероника Михайловна Воробьева; Наталья Владимировна Бурцева 
1878;   Анализ данных в Google Analytics — Stepik; 5; Курс посвящен методам и инструментам в Google Analytics, с помощью которых вы можете анализировать данные и принимать решения.; None; Андрей Осипов 
1906;   Adaptive GMAT Data Sufficiency Problems — Stepik; None; Adaptive course for preparation to the GMAT Data Sufficiency section; None; Maxim Skryabin 
1924;   курс по Игрофикации со статусом "Эксперт" (продвинутый уровень) — Stepik; 5; Этот курс создан для того, чтобы можно было получить сертификат со статусом Эксперта за прохождение курса Игрофикация на платформе Stepik; None; Miroslava Bronnikova 
1970;   Let's build a simple interpreter — Stepik; None; This is a simple course for building interpreter in Python, much inspired by this articles https://ruslanspivak.com/lsbasi-part1/, but with interactive base.; None; None 
2009;   Экспресс-курс "Управление проектами в MS-Project 2016" — Stepik; 4.8; Курс о том, как эффективно использовать систему управления проектом Microsoft Project 2016.Теоретический материал курса базируется на требованиях к структуре и составу процессов управления, изложенных в стандартах Института Управления Проектами (PMI, PMBOK).; None; Alex Zubritsky 
2036;   Антарос — Помощник Директолога — Stepik; None; ; None; Александр Остроух 
2041;   Методика судейства и концепция состязаний ВРО 2017 — Stepik; 4.3; Подготовка судей региональных этапов и заключительного этапа Всероссийской Робототехнической Олимпиады 2017; None; Рустам Кагапов 
2051;   Разработка модулей ядра Linux — Stepik; 4.3; Данный курс посвящен программированию в ядре Linux. Слушатели узнают об архитектуре ядра, научатся разрабатывать драйверы простейших символьных устройств, узнают о приницпах работы с внутренними структурами.; СПбГЭТУ «ЛЭТИ»; Кирилл Кринкин, OSLL, Mark Zaslavskiy, Tatyana Berlenko 
2057;   Python. Functional Programming — Stepik; 5; The course is about functional elements available in Python and their usage; None; Vitaliy Polshkov 
2069;   Русский по-взрослому — Stepik; None; Курс по грамотности и культуре речи для взрослых. Автор и ведущая - Анна Валл.; None; IGRO Речевая тренинговая компания 
2093;   Beginner's Modules for Week 1 (EdX) — Stepik; None; Week 1 of "Beginner's Track" at EdX; None; Phillip Compeau 
2119;   Конструирование космической техники — Stepik; 4; Если Вы уже представляете в общих чертах, как работают спутники и для чего они нужны, и хотите узнать больше, то этот курс для Вас!Лекторы курса - действующие инженеры из ракетно-космической промышленности, с РКЦ "Прогресс" (Самара), ВНИИЭМ (Москва), НПО им. Лавочкина (Химки, Московская область) и других предприятий, подробно расскажут о конструкции современной космической техники - о корпусах спутников, их бортовой кабельной сети, антеннах, ракетных двигателях, системах энергопитания, обеспечения теплового режима, ориентации и стабилизации.; None; Образование будущего ЦК, Роман Гуров, Александр Шаенко, Евгений Космодемьянский, Александр Хромов, Леонид Король, Павел Телепнев 
2152;   Основы статистики. Часть 3 — Stepik; 4.7; В данном курсе мы продолжаем наш разговор об анализе данных. В курсе более подробно рассматриваются темы в области регрессионного анализа, разбираются такие важные вопросы как повторные измерения в статистике и смешанные регрессионные модели.; Bioinformatics Institute; Anatoliy Karpov, Иван Иванчей, Polina Drozdova, Arseny Moskvichev 
2159;   Applied Computer Science. Git — Stepik; 4.7; The course describes most frequently used git commands from real-world workflows.; None; Mark Zaslavskiy, Artyom Filatov, Anton Filatov, Tatyana Berlenko, Кирилл Кринкин, OSLL 
2175;   Английский  — Stepik; None; Изучение онлайн бесплатно ; None; Елена Головизина 
2223;   JavaScript для начинающих — Stepik; 4.7; В данном курсе рассмотрены основы программирования на JavaScript а также некоторые инструменты и модели данных, необходимые для практического использования JavaScript.; None; Anton Kholin 
2228;   Межличностное общение — Stepik; 3.5; В данном курсе мы рассмотрим основы межличностного общения; None; Ровшан Мустафаев 
