2244;   Passwords: An Overt Enigma — Stepik; None; Do you really know what a password is? Have you ever pondered why you call your password "yours" and how true your claim is? These are not vain questions. Despite the answers are plain they a somehow ungraspable for a normal person, as if these answers require you to visit very dark corners of your consciousness.you will learn:- what a password is and what a password isn't- what is a password and what isn't a password- what a password's "strength" is- what makes your password YOURS- how to create a "good" password- how much you were mislead by the "best practices"- how to make your services more comfortable for users with respect to authentication(optionally) you will also learn how to apply very basic mathlogic to real life situations.; None; Eugene Panferov 
2300;   Литература/Подготовка к ЕГЭ — Stepik; None; Курс помогает закрыть возможные пробелы в литературе и успешно сдать экзамен. ; None; easy katka 
2310;   SPACE-МОДЕЛЬ построения взаимоотношений — Stepik; None; Когда вы создаете свои проекты, то возникает необходимость правильно строить взаимоотношения со своим ближним, средним и дальним окружением. Как же все отношения и все контакты разложить по полочкам и правильно ими пользоваться? Используя SPACE-МОДЕЛЬ вы наведете полный порядок во взаимоотношениях и успешно создадите сеть моральной, партнерской и клиентской поддержки вашего социального (или коммерческого) проекта!; None; Виктор Казадаев 
2341;   Введение в разработку приложений на Sailfish OS — Stepik; 5; Курс познакомит слушателя с основами разработки под мобильные устройства, работающие на операционной системе Sailfish OS. После прохождения курса слушатели смогут самостоятельно разрабатывать и публиковать собственные приложения.; None; FRUCT Association, Ксения Лагутина 
2347;   Подготовка к ОГЭ по информатике (интенсивный курс) — Stepik; 5; Курс рассчитан для обучающихся 8-9 классов школ, лицеев и гимназий, готовящихся к сдаче основного государственного экзамена по информатике.; None; Тимур Тазетдинов 
2403;   Adaptive Java — Stepik; 5; Adaptive problem set to learn Java. Join the course and you can try out the first prototype of the adaptive engine!; JetBrains; None 
2426;   ЕГЭ Математика(база) — Stepik; None; для всех нубов, которые не могут подготовиться сами.; None; Алексей Васин 
2438;   Порошки без ноги — Stepik; 4.9; Интеллектуальная викторина со смешными стихами. ; None; Никита Коробков 
2480;   General English for First-Year Students of Humanities — Stepik; 4.5; Авторы (кафедра английского языка для гуманитарных специальностей ННГУ им. Н.И. Лобачевского)Золотова М.В., Демина О.А., Каминская Н.В., Ганюшкина Е.В., Телегина О.В.,  Савицкая А.О., Чащин В.А.; None; Виталий Чащин 
2531;   тригонометрия — Stepik; None; основы тригонометрии; None; artem kochegarov 
2542;   Неорганическая химия: введение в химию элементов — Stepik; 3; Курс посвящен современному состоянию теории периодичности – развитию Периодического закона Д.И.Менделеева от открытия до наших дней. На многочисленных примерах раскрываются закономерности изменения свойств s, p, d, f-элементов и химических соединений, демонстрируется возможность прогнозирования важнейших характеристик веществ. Представлены современные направления развития неорганической химии в СПбГУ.; Санкт-Петербургский государственный университет; Алексей Тимошкин, Михаил Скрипкин, Oleg Levin, Боярский Вадим Павлович, egrachova, Сергей Шугуров, Василий Хрипун, Татьяна Севастьянова 
2606;   Stepik Contest. JavaScript — Stepik; 4; The course consists of the best lessons that were submitted for the Stepik Contest (http://adaptive.stepik.org).; None; Natalia Feofanova 
2607;   Stepik Contest. Data Science — Stepik; None; The course consists of the best lessons that were submitted for the Stepik Contest (http://adaptive.stepik.org/).; None; Natalia Feofanova 
2614;   Базы данных — Stepik; 4.3; Курс знакомит слушателей с основными принципами работы со структурированными данными в реляционной модели, учит проектировать данные, описывать объекты базы данных в терминах реальной СУБД, составлять запросы на языке SQL, использовать представления, процедуры, функции и триггеры, создавать индексы, управлять конкурентным доступом к данным и манипулировать механизмом транзакций; Санкт-Петербургский государственный университет; Елена Михайлова, Наталья Графеева 
2621;   ОСНОВЫ Html & CSS  — Stepik; 4.3; Курс направлен на изучение ОСНОВ HTML, CSS для новичков, начинающих и людей не знакомых с этим, но взявших путь освоить. Материал составлен учителем информатики и успешно применяется на уроках в школе.Для людей знающих HTML - уроки не расскажут о новом и покажутся поверхностными.; None; Антон Глухов 
2731;   Имя существительное как часть речи. — Stepik; None; Курс содержит теоретический и практический материал, тесты разного уровня сложности, игровые задания.; Вероника Михайловна Воробьева; Елена Ивановна Рутковская 
2798;   География. 5-11 классы. — Stepik; None; Программа школьного курса по географии с 5 по 11 классы.; None; Шакирзянов Дмитрий 
2822;   Экономические районы России — Stepik; None; В этом дистанционном курсе Вы познакомитесь с комплексной характеристикой экономических районов, выявите взаимосвязи между природой, населением и хозяйством России, при этом Вами будут использоваться уже имеющиеся знания о компонентах природы, различных сторонах жизни населения и отраслях хозяйства. ; Вероника Михайловна Воробьева; Людмила Александровна Матыцина 
2828;   Математика 4 — Stepik; None; Математика для учащихся 4 года обучения; None; Склад Ума 
2852;   Kotlin — Stepik; 4.5; This problem set is based on official Kotlin Koans, which are released under the MIT License.; JetBrains; None 
2887;   Python PyPI package publication — Stepik; 5; Practice oriented guide about creating PyPI package. In each step you will be working with the small python project, turning it into complete installable package.; None; Mark Zaslavskiy, Evgeny Bovykin 
2911;   Теория вероятностей – наука о случайности — Stepik; 5; Курс познакомит с основными правилами исчисления вероятностей, обращая внимание на базовые идеи и концепции, научит решать вероятностные задачи, пользуясь формальным аппаратом. Курс позволит освоить элементарные вероятностные методы и применять их в быту и профессиональной деятельности, будет способствовать развитию рационального мышления и способности выражать мысли в математической форме.; None; Томский государственный университет 
2927;   Сложение и вычитание дробей с одинаковыми знаменателями — Stepik; None; Данный курс рассчитан на учащихся 5-х классов. ; None; Алена Смирнова 
2932;   Таможенное декларирование через сервис Контур.Декларант — Stepik; 3.3; Курс разрабатывается для пользователей веб-сервиса Контур.Декларант с целью их ознакомления с сервисом и процессом декларирования.; None; Контур.Декларант 
2955;   История Древнего мира — Stepik; None; При изучении курса всеобщей истории «История Древнего мира»  происходит знакомство учащихся с процессом формирования человека и человеческого общества, с важнейшими цивилизациями Древнего мира. ; None; Галина Алексеевна Артюшенко, Вероника Михайловна Воробьева 
3005;   Электроника и схематехника аналоговых устройств — Stepik; 3.3; В результате изучения курса студент освоит основные принципы построения аналоговых электронных схем, принципы функционирования усилительных и преобразовательных каскадов, генераторов сигналов, электрических фильтров, принципы работы аналоговых интегральных микросхем, разных аспектов применения элементной базы электроники в практической деятельности.; None; Dinara Kilimova 
3032;   CloudCoder Exercises — Stepik; None; Problem set based on CloudCoder exercise repository (https://cloudcoder.org/repo/).; Команда Stepik; None 
3089;   Теория вероятностей — Stepik; 5; Курс знакомит слушателей с базовыми понятиями теории вероятностей: вероятностным пространством, условной вероятностью, случайными величинами, независимостью, математическим ожиданием и дисперсией. Доказываются закон больших чисел и некоторые версии предельных теорем. Разобрано много примеров и задач.; Computer Science Center (CS центр); Александр Храбров 
3124;   Common English Verbs — Stepik; 4; Adaptive problem set to check your knowledge of the most common English verbs. Join the course and try out the first prototype of the adaptive engine!; None; Asya Samsonova, Stepik 
3128;   Задачи вступительных олимпиад физико-математических школ — Stepik; 5; Курс предназначен в первую очередь для учеников девятого класа, которые готовятся к поступлению в Лицей "Физико-Техническая Школа". В курсе рассматриваются основные методы решения задач из вступительных олимпиад по математике и физике прошлых лет. Курс может быть полезен всем кто собирается поступать в физико-математические лицеи или просто хочет научится решать нестандартные задачи.; Лицей Физико-Техническая Школа; Andrey Aktersky 
3149;   Common English Adjectives — Stepik; 4; Adaptive problem set to check your knowledge of the most common English adjectives. Join the course and try out the first prototype of the adaptive engine!; None; Asya Samsonova, Stepik 
3150;   TOEFL vocabulary — Stepik; 3.9; Adaptive problem set to check your knowledge of the most important words for the TOEFL. Join the course and try out the first prototype of the adaptive engine!; None; Asya Samsonova, Stepik 
3191;   Измерение, кодирование и обработка информации — Stepik; 5; Курс представляет собой собрание лучших практик по подготовке к экзаменам (ОГЭ, ЕГЭ) в рамках тем: измерение информации (содержательный, алфавитный, вероятностный подходы), кодирование разных типов информации (системы счисления, текст, графика, звук и видео), обработка чисел в электронных таблицах. Курс включает в себя много практических заданий с рецензией в текстовых редакторах, задач на программирование, практические работы в звуковых и видеоредакторах; много расчетных задач, связанных с углубленной и эффективной подготовкой к экзаменам. Курс больше подойдет десятиклассникам, однако совершенно любой заинтересованный человек может пройти его при собственном желании.; None; Михаил Сергеевич Солкин 
3209;   Теория вероятностей – наука о случайности. Часть 2 — Stepik; 5; Во второй части курса "Теория вероятностей – наука о случайности" мы начинаем рассматривать непрерывные вероятностные пространства, что существенно расширяет аналитические возможности теории и позволяет строить интересные модели, используя более продвинутый математический аппарат.; Томский государственный университет; ann kit 
3212;   Django Tutorial — Stepik; 2; Django Tutorial based on Django Girls Tutorial and Django official documentation; None; JetBrains, https://www.jetbrains.com/ 
3215;   Logging in Python — Stepik; 5; This course provides an introduction to the standard Python logging module. It includes basic and advanced examples that can help you debug your Python software. Best practices are demonstrated to help you get the most out of Python logging. This course was tested using Python 2.7 and Python 3.6.; None; JetBrains, https://www.jetbrains.com/ 
3222;   Введение в Robot Operating System — Stepik; 4.8; Курс помогает освоиться в Robot Operating System. Пройдя этот курс, вы овладеете знаниями о структуре этой системы и сможете создавать программы, использующие ROS; None; Кирилл Кринкин, OSLL, Anton Filatov, Artyom Filatov 
3278;   Многопоточность в iOS (Swift) — Stepik; 4.6; Познакомьтесь и изучите практически все способы многопоточного программирования под iOS (swift), в том числе малоизвестные.; Avito; Алексей Щукин 
3297;   German language  — Stepik; 3; i can help you in improving your German language and benefit from each other .; None; Anan Safwat 
3331;   APCS Java at Hinsdale South High School — Stepik; None; APCS Java Practice used at Hinsdale South High School; None; John Schlamann 
3352;   Программирование на Pascal — Stepik; 4.3; Учебный онлайн курс направлен на практическое изучение школьниками языка Pascal и основ алгоритмики. Изложение материала ориентировано на активное практическое изучение языка Pascal и приемов создания эффективных алгоритмов. Большое количество практических заданий позволят на практике проверить полученные знания, закрепить полезные умения и навыки.; None; Александра Иванова 
3356;   Практикум по математике и Python — Stepik; 4.8; Практикум для курса на Coursera "Математика и Python для анализа данных" с наборами дополнительных задач и материалов для углублённого и более детального изучения материала.Практикум находится на стадии разработки.; None; Алексей Задойный 
3406;   История России ЕГЭ  — Stepik; None; Курс для подготовки к ЕГЭ. Типовые задания ; None; Максим Вальков 
3428;   биология — Stepik; None; авппва; None; vas 
3432;   JavaScript for Beginners — Stepik; 4.8; This course covers the basics of programming in JavaScript, as well as some of the tools and data models that are necessary for the practical use of JavaScript.; None; Anton Kholin 
3468;   Публичная дипломатия США — Stepik; 5; Курс формирует новые экспертные знания и умения в области внешней политики и публичной дипломатии США (public diplomacy). Публичная дипломатия США — это правительственный внешнеполитический механизм США, состоящий из таких методов, как:1) информационные проекты (пропаганда);2) образовательные и культурные обмены;3) проекты в сети Интернет (цифровая дипломатия США).; Санкт-Петербургский государственный университет; Наталья Цветкова 
3483;   Polski.1 — Stepik; None; Польский язык. Начинаем говорить на 1 занятии. ; None; Ivanna 
3554;   Полезные функции Excel — Stepik; 4.7; Курс знакомит слушателей с базовыми функциями Excel, а также с самыми необходимыми в работе формулами; Альфа-Опыт; Александр Лещев 
3559;   Информатика. 7 класс — Stepik; 4.5; Практические задания к школьному курсу информатики 7 класса.Больше информации смотрите на сайте http://новиков-дм.рф/7-класс/; None; Дмитрий Новиков 
3616;   Основы робототехники ВНГ — Stepik; 5; Для самостоятельного обучения основам робототехники и как средство дополнения урочных занятий. 1111111111111111111пппппппппппп п п пп п п п п п п п п п пукцп 53 е23а е2м 45ес3ем 2ес ; None; Павел Оконечников 
3636;   XV6 лабораторные — Stepik; None; Набор лабораторных для учебной операционной системы xv6 (https://ocw.mit.edu/courses/electrical-engineering-and-computer-science/6-828-operating-system-engineering-fall-2012/labs/); None; Mark Zaslavskiy, Кирилл Кринкин, OSLL 
3709;   Металлические конструкции, включая сварку — Stepik; 4.5; Курс для студентов ВУЗов строительных специальностей; None; Екатерина Карлова 
3738;   1C:Drive English for Developers ОЗНАКОМИТЕЛЬНАЯ версия — Stepik; None; Фокусируясь на главном – продуктах 1С:Предприятие, мы научим тебя выполнять ежедневные задачи на английском языке. Этот курс основан на 1C:Drive: первый из серии курсов.Это ТЕСТОВАЯ ознакомительная версия курса. Вы можете записаться на ПОЛНУЮ версию курса на нашем вебсайте http://rise1c.academy/.; None; Your Trainer 
3788;   Методи емпіричних досліджень (онлайн-курс Раренко Л.А.) — Stepik; None; ВСТУПРОЗДІЛ 1. Методи досліджень у журналістикознавстві1.1.Описові методи1.2.Аналіз документальної інформації1.3.Спостереження1.4.Опитування1.4.1.Інтерв’ю1.4.2.Анкетне опитування1.4.3.Експертне опитування1.5.ЕкспериментРОЗДІЛ 2. Обробка, аналіз та інтерпретація результатів дослідження2.1. Проблема вимірювань у гуманітарних науках2.2. Попередня обробка результатів спостережень і опитувань.2.3. Основні статистичні поняття.2.4. Прогнозування2.5. Оцінювання ефективності рекламних і PR-кампаній.; None; Раренко Лариса 
3871;   test — Stepik; None; test; None; Alexandra Orishchenko 
3976;   Курс по осознанному питанию "Твое новое Тело" — Stepik; None; 1. В курсе рецепты на 4 недели, простые , вкусные и быстрые, помогут научиться готовить полезно и экономно, помогут снизить лишний вес и поправить здоровье!2. Видео уроки от автора курса: принципы питания, о бадах, Психология питания и др. Информация  эксклюзивная, её не найти на просторах интернета.3. Видео упражнения от автора курса, можно тренироваться дома, что не займёт много времени , но поможет подтянуть фигуру.4. Возможность быть в чате, где автор даёт важную информацию и много полезного, сможете быть в нем бессрочно и постоянно задавать вопросы!Курс основан на вкусном и полезном питании, чтобы снизить вес и подтянуть фигуру с удовольствием!; None; Марина Римарчук 
3999;   как не стать бомжом!!! — Stepik; None; учись.это первое. бе бе бе бе бее  бе; None; Вероника Журина 
